{
  "version": 1,
  "generated_from": "YAML frontmatter",
  "documents": [
    {
      "id": "ai-architecture",
      "title": "Kiến trúc AI Platform",
      "status": "active",
      "owner_role": "engineering-lead",
      "scope": "ai",
      "when_to_read": [
        "ai-boundary",
        "customer-chatbot",
        "ai-tool"
      ],
      "tags": [
        "fastapi",
        "architecture",
        "rag"
      ],
      "revision": "2026-07-27.1",
      "review_date": "2026-08-23T00:00:00.000Z",
      "supersedes": [],
      "path": "backend/ai/docs/architecture.md",
      "source_hash": "5d0d9921f7a919a3535867f3e91ffc30685397255a5bb05f23264bc004eb23c8"
    },
    {
      "id": "ai-conversation-graph",
      "title": "LangGraph Conversation State Machine",
      "status": "active",
      "owner_role": "engineering-lead",
      "scope": "ai",
      "when_to_read": [
        "customer-conversation",
        "ai-assistant",
        "session-concurrency",
        "ai-vision"
      ],
      "tags": [
        "langgraph",
        "state-machine",
        "assistant"
      ],
      "revision": 4,
      "review_date": "2026-08-23T00:00:00.000Z",
      "supersedes": [],
      "path": "backend/ai/docs/conversation-graph.md",
      "source_hash": "ddb0b0afb3a8c54f16c6c25191b4e57be95bb73fb70e12fec0717c2b409202e2"
    },
    {
      "id": "ai-dataset-engineering",
      "title": "Dataset Factory cho Customer Chatbot",
      "status": "active",
      "owner_role": "data-owner",
      "scope": "ai",
      "when_to_read": [
        "dataset-source",
        "synthetic-dataset",
        "dataset-release",
        "ai-dataset"
      ],
      "tags": [
        "dataset",
        "evaluation",
        "synthetic-data"
      ],
      "revision": 5,
      "review_date": "2026-08-28T00:00:00.000Z",
      "supersedes": [],
      "path": "backend/ai/docs/dataset-engineering.md",
      "source_hash": "e5223cb2c613d680ed12526cf10a95e2aa75f4bfb69740f63540a1cf8fe2b85f"
    },
    {
      "id": "ai-evaluation-release",
      "title": "AI evaluation và release evidence",
      "status": "active",
      "owner_role": "engineering-lead",
      "scope": "ai",
      "when_to_read": [
        "ai-evaluation",
        "ai-release",
        "fine-tuning"
      ],
      "tags": [
        "evaluation",
        "release",
        "ai-safety"
      ],
      "revision": "2026-07-25.2",
      "review_date": "2026-08-23T00:00:00.000Z",
      "supersedes": [
        "ai-security-profiles-release"
      ],
      "path": "backend/ai/docs/evaluation-and-release.md",
      "source_hash": "81603a504740fa41563b3a9438355f301ccaa846352cb2790cc4e954e5137cd6"
    },
    {
      "id": "ai-inference-serving",
      "title": "Governed model gateway và inference serving",
      "status": "active",
      "owner_role": "engineering-lead",
      "scope": "ai",
      "when_to_read": [
        "local-inference",
        "model-routing",
        "provider-fallback",
        "ai-finops"
      ],
      "tags": [
        "inference",
        "vllm",
        "finops",
        "resilience"
      ],
      "revision": 7,
      "review_date": "2026-08-23T00:00:00.000Z",
      "supersedes": [],
      "path": "backend/ai/docs/inference-serving.md",
      "source_hash": "e26c91776ad7d11dae9397bba52f0045a442235527df9ab5868de31bea0f7804"
    },
    {
      "id": "ai-knowledge-data-governance",
      "title": "Knowledge và dataset governance của AI Platform",
      "status": "active",
      "owner_role": "data-owner",
      "scope": "ai",
      "when_to_read": [
        "dataset",
        "data-governance",
        "ai-dataset",
        "ai-retrieval"
      ],
      "tags": [
        "dataset",
        "rag",
        "retrieval",
        "governance"
      ],
      "revision": "2026-07-23.2",
      "review_date": "2026-08-23T00:00:00.000Z",
      "supersedes": [],
      "path": "backend/ai/docs/knowledge-data-governance.md",
      "source_hash": "dc5d4d06c18b0678f9c1bdad396392daf720b8e3ca2cbaec2bd2dd01211a79c9"
    },
    {
      "id": "ai-knowledge-ingestion",
      "title": "Knowledge-source ingestion của AI Platform",
      "status": "active",
      "owner_role": "data-owner",
      "scope": "ai",
      "when_to_read": [
        "dataset-source",
        "knowledge-ingestion",
        "ai-retrieval"
      ],
      "tags": [
        "knowledge",
        "ingestion",
        "retrieval",
        "data-governance"
      ],
      "revision": 4,
      "review_date": "2026-08-23T00:00:00.000Z",
      "supersedes": [],
      "path": "backend/ai/docs/knowledge-ingestion.md",
      "source_hash": "ed9e21e98f02b433ff5f9ff84cfcc8767a97965639fb1b49f7d4bd06e9d480b7"
    },
    {
      "id": "ai-knowledge-release",
      "title": "Knowledge revision và atomic release",
      "status": "active",
      "owner_role": "data-owner",
      "scope": "ai",
      "when_to_read": [
        "knowledge-revision",
        "knowledge-release",
        "ai-retrieval",
        "webhook"
      ],
      "tags": [
        "rag",
        "revision",
        "release"
      ],
      "revision": 4,
      "review_date": "2026-08-23T00:00:00.000Z",
      "supersedes": [],
      "path": "backend/ai/docs/knowledge-release.md",
      "source_hash": "d6469173656a701ad071887d8f62237a423f88a4412d98edb1abb53c2f8d5ca6"
    },
    {
      "id": "ai-safety-abuse",
      "title": "AI safety and abuse controls",
      "status": "active",
      "owner_role": "security-owner",
      "scope": "ai",
      "when_to_read": [
        "ai-safety",
        "prompt-injection",
        "data-poisoning",
        "ai-tool",
        "ai-incident",
        "ai-vision",
        "multimodal-injection"
      ],
      "tags": [
        "ai",
        "security",
        "abuse"
      ],
      "revision": "2026-07-23.2",
      "review_date": "2026-08-23T00:00:00.000Z",
      "supersedes": [
        "ai-security-profiles-release"
      ],
      "path": "backend/ai/docs/safety-and-abuse.md",
      "source_hash": "6cfd88639e676eaaffcd125e0aefca42c055ae5ab7a93167a3a65316c0af7142"
    },
    {
      "id": "plan-vfbiz-0003",
      "title": "FastAPI AI Platform rebuild plan",
      "status": "archived",
      "owner_role": "data-owner",
      "scope": "ai",
      "when_to_read": [
        "ai-rebuild"
      ],
      "tags": [
        "plan",
        "fastapi",
        "ai"
      ],
      "revision": 1,
      "review_date": "2026-07-22T00:00:00.000Z",
      "supersedes": [],
      "path": "docs/work/archive/VFBIZ-0003-fastapi-ai-rebuild.md",
      "source_hash": "b449f0d8b1cb700a55f686f435de90b963ebb98432741926eee0df5dc399f1da"
    },
    {
      "id": "api-ai-gateway-tools",
      "title": "AI Gateway và read-only tools của API Platform",
      "status": "active",
      "owner_role": "engineering-lead",
      "scope": "api",
      "when_to_read": [
        "customer-conversation",
        "ai-client",
        "ai-tool",
        "ai-vision",
        "local-inference"
      ],
      "tags": [
        "ai-gateway",
        "tools",
        "security",
        "resilience"
      ],
      "revision": 3,
      "review_date": "2026-08-23T00:00:00.000Z",
      "supersedes": [],
      "path": "backend/api/docs/ai-gateway-and-tools.md",
      "source_hash": "0bfd141c3ba0e75f49e2c605d73a556997f7728a3cef3023c6bd6cb761613546"
    },
    {
      "id": "api-architecture",
      "title": "Kiến trúc API Platform",
      "status": "active",
      "owner_role": "engineering-lead",
      "scope": "api",
      "when_to_read": [
        "api-boundary",
        "public-contract",
        "authorization",
        "integration"
      ],
      "tags": [
        "nestjs",
        "architecture"
      ],
      "revision": "2026-07-27.2",
      "review_date": "2026-08-22T00:00:00.000Z",
      "supersedes": [],
      "path": "backend/api/docs/architecture.md",
      "source_hash": "e52c4b1511f2405cd082059f3db6c17ba01d1c8407e94aed26ce5a0749eb5aa6"
    },
    {
      "id": "api-conversation-runtime",
      "title": "Conversation runtime của API Platform",
      "status": "active",
      "owner_role": "engineering-lead",
      "scope": "api",
      "when_to_read": [
        "customer-conversation",
        "support-handoff",
        "session-concurrency"
      ],
      "tags": [
        "conversation",
        "handoff",
        "concurrency",
        "privacy"
      ],
      "revision": 4,
      "review_date": "2026-08-23T00:00:00.000Z",
      "supersedes": [],
      "path": "backend/api/docs/conversation-runtime.md",
      "source_hash": "a27ad7d8f3647441e45600cc8debd4c1696367fc85a23e113ef0343e2d99f4c8"
    },
    {
      "id": "api-data-model",
      "title": "Data model và quyền sở hữu dữ liệu API Platform",
      "status": "active",
      "owner_role": "engineering-lead",
      "scope": "api",
      "when_to_read": [
        "schema",
        "migration",
        "persistence",
        "data-ownership"
      ],
      "tags": [
        "prisma",
        "postgresql",
        "data"
      ],
      "revision": "2026-07-24.2",
      "review_date": "2026-08-22T00:00:00.000Z",
      "supersedes": [],
      "path": "backend/api/docs/data-model.md",
      "source_hash": "9abf592b942df5055b06598c6872b886b63003d0f04c0caf0c3201b3f69c2b9d"
    },
    {
      "id": "api-identity-and-account",
      "title": "Identity và Account runtime",
      "status": "active",
      "owner_role": "engineering-lead",
      "scope": "api",
      "when_to_read": [
        "identity",
        "customer-account",
        "customer-profile",
        "consent",
        "customer-session",
        "dsar"
      ],
      "tags": [
        "nestjs",
        "identity",
        "customer",
        "privacy"
      ],
      "revision": 12,
      "review_date": "2026-08-23T00:00:00.000Z",
      "supersedes": [],
      "path": "backend/api/docs/identity-and-account.md",
      "source_hash": "9fa8c266cba825b67a90eb92d46da7e248bfef26a032c1ed4523ae99aa8370dc"
    },
    {
      "id": "api-integration-adapters",